{
  "schema_version": "1.0",
  "snapshot_id": "asset_20260904_151000_001",
  "request_id": "req_aaaaaaaaaaaaaaaaaaaaaaaaaaaaaaaa",
  "node_id": "node-shanghai-001",
  "account_id": "acct_primary_001",
  "trade_date": "2026-09-04",
  "as_of": "2026-09-04T15:10:00+08:00",
  "query_status": "AVAILABLE",
  "broker_account_status": "OK",
  "asset": {
    "cash": "820000.00",
    "frozen_cash": "0.00",
    "market_value": "180000.00",
    "total_asset": "1000000.00",
    "fetch_balance": "820000.00",
    "current_balance": "820000.00"
  }
}
